{
  "schema_version": "1.0.0",
  "version": "v1",
  "generated_at": "2026-03-11T09:56:55Z",
  "null_entry": {
    "id": 0,
    "rgb": [
      0,
      0,
      0
    ],
    "semantic": "OCEAN_NULL",
    "display_name": "Ocean / No Hit",
    "iso_a2": null,
    "iso_a3": null
  },
  "entries": [
    {
      "id": 1,
      "rgb": [
        1,
        0,
        0
      ],
      "iso_a2": "AW",
      "iso_a3": "ABW",
      "display_name": "Aruba",
      "center_lat": 12.524909,
      "center_lon": -69.969614,
      "bbox": [
        -70.062408,
        12.41767,
        -69.87682,
        12.632148
      ]
    },
    {
      "id": 2,
      "rgb": [
        2,
        0,
        0
      ],
      "iso_a2": "AF",
      "iso_a3": "AFG",
      "display_name": "Afghanistan",
      "center_lat": 33.930139,
      "center_lon": 67.689542,
      "bbox": [
        60.486778,
        29.386605,
        74.892307,
        38.473673
      ]
    },
    {
      "id": 3,
      "rgb": [
        3,
        0,
        0
      ],
      "iso_a2": "AO",
      "iso_a3": "AGO",
      "display_name": "Angola",
      "center_lat": -11.211304,
      "center_lon": 17.865554,
      "bbox": [
        11.669394,
        -18.031405,
        24.061714,
        -4.391204
      ]
    },
    {
      "id": 4,
      "rgb": [
        4,
        0,
        0
      ],
      "iso_a2": "AI",
      "iso_a3": "AIA",
      "display_name": "Anguilla",
      "center_lat": 18.369094,
      "center_lon": -63.228822,
      "bbox": [
        -63.428822,
        18.169094,
        -62.925682,
        18.601264
      ]
    },
    {
      "id": 5,
      "rgb": [
        5,
        0,
        0
      ],
      "iso_a2": "AL",
      "iso_a3": "ALB",
      "display_name": "Albania",
      "center_lat": 41.145913,
      "center_lon": 20.154356,
      "bbox": [
        19.272033,
        39.637013,
        21.036679,
        42.654814
      ]
    },
    {
      "id": 6,
      "rgb": [
        6,
        0,
        0
      ],
      "iso_a2": "AX",
      "iso_a3": "ALD",
      "display_name": "\u00c5land",
      "center_lat": 60.192633,
      "center_lon": 20.304942,
      "bbox": [
        19.513194,
        59.904486,
        21.09669,
        60.48078
      ]
    },
    {
      "id": 7,
      "rgb": [
        7,
        0,
        0
      ],
      "iso_a2": "AD",
      "iso_a3": "AND",
      "display_name": "Andorra",
      "center_lat": 42.53902,
      "center_lon": 1.585774,
      "bbox": [
        1.406456,
        42.428677,
        1.765091,
        42.649362
      ]
    },
    {
      "id": 8,
      "rgb": [
        8,
        0,
        0
      ],
      "iso_a2": "AE",
      "iso_a3": "ARE",
      "display_name": "United Arab Emirates",
      "center_lat": 24.175177,
      "center_lon": 53.976492,
      "bbox": [
        51.569347,
        22.620946,
        56.383637,
        26.074792
      ]
    },
    {
      "id": 9,
      "rgb": [
        9,
        0,
        0
      ],
      "iso_a2": "AR",
      "iso_a3": "ARG",
      "display_name": "Argentina",
      "center_lat": -38.419477,
      "center_lon": -63.617146,
      "bbox": [
        -73.57274,
        -55.052016,
        -53.661552,
        -21.786938
      ]
    },
    {
      "id": 10,
      "rgb": [
        10,
        0,
        0
      ],
      "iso_a2": "AM",
      "iso_a3": "ARM",
      "display_name": "Armenia",
      "center_lat": 40.077077,
      "center_lon": 45.019453,
      "bbox": [
        43.436294,
        38.863701,
        46.602612,
        41.290452
      ]
    },
    {
      "id": 11,
      "rgb": [
        11,
        0,
        0
      ],
      "iso_a2": "AS",
      "iso_a3": "ASM",
      "display_name": "American Samoa",
      "center_lat": -14.184739,
      "center_lon": -169.623504,
      "bbox": [
        -171.086537,
        -14.532892,
        -168.160471,
        -11.051365
      ]
    },
    {
      "id": 12,
      "rgb": [
        12,
        0,
        0
      ],
      "iso_a2": "AQ",
      "iso_a3": "ATA",
      "display_name": "Antarctica",
      "center_lat": -75.258104,
      "center_lon": 0.0,
      "bbox": [
        -180.0,
        -90.0,
        180.0,
        -60.516209
      ]
    },
    {
      "id": 13,
      "rgb": [
        13,
        0,
        0
      ],
      "iso_a2": "AU",
      "iso_a3": "ATC",
      "display_name": "Ashmore and Cartier Islands",
      "center_lat": -12.388572,
      "center_lon": 123.575043,
      "bbox": [
        123.575043,
        -12.438572,
        123.597748,
        -12.426609
      ]
    },
    {
      "id": 14,
      "rgb": [
        14,
        0,
        0
      ],
      "iso_a2": "TF",
      "iso_a3": "ATF",
      "display_name": "French Southern and Antarctic Lands",
      "center_lat": -30.636122,
      "center_lon": 58.656749,
      "bbox": [
        39.728282,
        -49.721612,
        77.585216,
        -11.550632
      ]
    },
    {
      "id": 15,
      "rgb": [
        15,
        0,
        0
      ],
      "iso_a2": "AG",
      "iso_a3": "ATG",
      "display_name": "Antigua and Barbuda",
      "center_lat": 17.23197,
      "center_lon": -61.94826,
      "bbox": [
        -62.34826,
        16.93197,
        -61.667592,
        17.727688
      ]
    },
    {
      "id": 16,
      "rgb": [
        16,
        0,
        0
      ],
      "iso_a2": "AU",
      "iso_a3": "AUS",
      "display_name": "Australia",
      "center_lat": -31.995294,
      "center_lon": 136.01295,
      "bbox": [
        112.919444,
        -54.750421,
        159.106456,
        -9.240167
      ]
    },
    {
      "id": 17,
      "rgb": [
        17,
        0,
        0
      ],
      "iso_a2": "AT",
      "iso_a3": "AUT",
      "display_name": "Austria",
      "center_lat": 47.694209,
      "center_lon": 13.334746,
      "bbox": [
        9.521155,
        46.378643,
        17.148338,
        49.009774
      ]
    },
    {
      "id": 18,
      "rgb": [
        18,
        0,
        0
      ],
      "iso_a2": "AZ",
      "iso_a3": "AZE",
      "display_name": "Azerbaijan",
      "center_lat": 40.141543,
      "center_lon": 47.700151,
      "bbox": [
        44.774559,
        38.392645,
        50.625743,
        41.890442
      ]
    },
    {
      "id": 19,
      "rgb": [
        19,
        0,
        0
      ],
      "iso_a2": "BI",
      "iso_a3": "BDI",
      "display_name": "Burundi",
      "center_lat": -3.383203,
      "center_lon": 29.910427,
      "bbox": [
        28.986892,
        -4.463344,
        30.833962,
        -2.303062
      ]
    },
    {
      "id": 20,
      "rgb": [
        20,
        0,
        0
      ],
      "iso_a2": "BE",
      "iso_a3": "BEL",
      "display_name": "Belgium",
      "center_lat": 50.49573,
      "center_lon": 4.448163,
      "bbox": [
        2.5218,
        49.495223,
        6.374525,
        51.496238
      ]
    },
    {
      "id": 21,
      "rgb": [
        21,
        0,
        0
      ],
      "iso_a2": "BJ",
      "iso_a3": "BEN",
      "display_name": "Benin",
      "center_lat": 9.306569,
      "center_lon": 2.29865,
      "bbox": [
        0.759881,
        6.213894,
        3.837419,
        12.399244
      ]
    },
    {
      "id": 22,
      "rgb": [
        22,
        0,
        0
      ],
      "iso_a2": "BF",
      "iso_a3": "BFA",
      "display_name": "Burkina Faso",
      "center_lat": 12.235895,
      "center_lon": -1.566205,
      "bbox": [
        -5.522578,
        9.391883,
        2.390169,
        15.079908
      ]
    },
    {
      "id": 23,
      "rgb": [
        23,
        0,
        0
      ],
      "iso_a2": "BD",
      "iso_a3": "BGD",
      "display_name": "Bangladesh",
      "center_lat": 23.681129,
      "center_lon": 90.33232,
      "bbox": [
        88.02179,
        20.738715,
        92.642851,
        26.623544
      ]
    },
    {
      "id": 24,
      "rgb": [
        24,
        0,
        0
      ],
      "iso_a2": "BG",
      "iso_a3": "BGR",
      "display_name": "Bulgaria",
      "center_lat": 42.733269,
      "center_lon": 25.474275,
      "bbox": [
        22.345023,
        41.238104,
        28.603526,
        44.228435
      ]
    },
    {
      "id": 25,
      "rgb": [
        25,
        0,
        0
      ],
      "iso_a2": "BH",
      "iso_a3": "BHR",
      "display_name": "Bahrain",
      "center_lat": 25.933665,
      "center_lon": 50.600202,
      "bbox": [
        50.38053,
        25.579891,
        50.819875,
        26.287439
      ]
    },
    {
      "id": 26,
      "rgb": [
        26,
        0,
        0
      ],
      "iso_a2": "BS",
      "iso_a3": "BHS",
      "display_name": "The Bahamas",
      "center_lat": 23.619605,
      "center_lon": -75.827848,
      "bbox": [
        -79.59435,
        20.912399,
        -72.746165,
        26.928412
      ]
    },
    {
      "id": 27,
      "rgb": [
        27,
        0,
        0
      ],
      "iso_a2": "BA",
      "iso_a3": "BIH",
      "display_name": "Bosnia and Herzegovina",
      "center_lat": 43.921868,
      "center_lon": 17.667479,
      "bbox": [
        15.716074,
        42.559212,
        19.618885,
        45.284524
      ]
    },
    {
      "id": 28,
      "rgb": [
        28,
        0,
        0
      ],
      "iso_a2": "XX",
      "iso_a3": "BJN",
      "display_name": "Bajo Nuevo Bank",
      "center_lat": 15.795193,
      "center_lon": -79.987843,
      "bbox": [
        -79.989288,
        15.794176,
        -79.986399,
        15.79621
      ]
    },
    {
      "id": 29,
      "rgb": [
        29,
        0,
        0
      ],
      "iso_a2": "BL",
      "iso_a3": "BLM",
      "display_name": "Saint Barth\u00e9lemy",
      "center_lat": 17.905565,
      "center_lon": -62.829498,
      "bbox": [
        -62.86734,
        17.881985,
        -62.791656,
        17.929145
      ]
    },
    {
      "id": 30,
      "rgb": [
        30,
        0,
        0
      ],
      "iso_a2": "BY",
      "iso_a3": "BLR",